<?xml version="1.0" encoding="UTF-8"?>

<nuke xmlns='http://atomnuke.org/configuration'
      xmlns:xsi='http://www.w3.org/2001/XMLSchema-instance'
      xsi:schemaLocation='http://atomnuke.org/configuration ../nuke-cfg.xsd'>

   <actors>
      <actor id="" type="" href="">
         <parameters>
            <param name="" value=""></param>
            <param name="" value=""></param>
            <param name="" value=""></param>
         </parameters>
      </actor>

      <actor id="" type="" href="">
         <parameters>
         </parameters>
      </actor>

      <actor id="" type="" href="">
         <parameters>
         </parameters>
      </actor>
   </actors>

   <bindings>
      <binding id="" sink-actor="" source-actor=""></binding>
      <binding id="" sink-actor="" source-actor=""></binding>
      <binding id="" sink-actor="" source-actor=""></binding>
   </bindings>
</nuke>
